[
  {
    "description": "Track Description",
    "filename": "filename3",
    "mark": "imagetest2",
    "metadata": {
      "albumArtist": "Epic Games",
      "artist": "Artist",
      "title": "Title",
      "year": "2010"
    },
    "source": {
      "structure": "Website"
    },
    "youtube": "GHpl05PmtOs"
  },
  {
    "description": "Used in 'FORTNITE SEASON 5 | ANNOUNCE TRAILER'",
    "filename": "Joywave - Blastoffff",
    "mark": "imagetest4",
    "metadata": {
      "albumArtist": "Joywave",
      "artist": "Joywave",
      "title": "Blastoffff ",
      "year": "2018"
    },
    "source": {
      "structure": "Video"
    },
    "youtube": "qSid2ulDL2Q"
  }
]
