[
  {
    "description": "Combat?",
    "filename": "breathingtrouble",
    "mark": "fortress",
    "metadata": {
      "albumArtist": "Senking",
      "artist": "Senking",
      "title": "torul",
      "year": "2010"
    },
    "source": {
      "client": "STW",
      "date": "2012-06-22",
      "structure": "Combat",
      "version": "FortressGame"
    },
    "youtube": "RCICBreK_rQ"
  },
  {
    "description": "Daytime Exploration",
    "filename": "deathbydrowning",
    "mark": "fortress",
    "metadata": {
      "albumArtist": "Senking",
      "artist": "Senking",
      "title": "Death by Drowning",
      "year": "2010"
    },
    "source": {
      "client": "STW",
      "date": "2012-06-22",
      "structure": "Area",
      "version": "FortressGame"
    },
    "youtube": "iyd67KQCSmc"
  },
  {
    "description": "Nighttime Exploration",
    "filename": "descentg",
    "mark": "fortress",
    "metadata": {
      "albumArtist": "Scuba",
      "artist": "Scuba",
      "title": "Descent",
      "year": "2010"
    },
    "source": {
      "client": "STW",
      "date": "2012-06-22",
      "structure": "Area",
      "version": "FortressGame"
    },
    "youtube": "FdwHBLeJRyA"
  },
  {
    "description": "Combat?",
    "filename": "eon",
    "mark": "fortress",
    "metadata": {
      "albumArtist": "Lucy",
      "artist": "Lucy",
      "title": "Eon",
      "year": "2011"
    },
    "source": {
      "client": "STW",
      "date": "2012-06-22",
      "structure": "Combat",
      "version": "FortressGame"
    },
    "youtube": "lQMY9Yv65bw"
  },
  {
    "description": "Combat?",
    "filename": "gas",
    "mark": "fortress",
    "metadata": {
      "albumArtist": "Lucy",
      "artist": "Lucy",
      "title": "gas",
      "year": "2011"
    },
    "source": {
      "client": "STW",
      "date": "2012-06-22",
      "structure": "Combat",
      "version": "FortressGame"
    },
    "youtube": "gArTLmH9fxA"
  },
  {
    "description": "Daytime Exploration",
    "filename": "lowflow",
    "mark": "fortress",
    "metadata": {
      "albumArtist": "Senking",
      "artist": "Senking",
      "title": "Low Flow",
      "year": "2010"
    },
    "source": {
      "client": "STW",
      "date": "2012-06-22",
      "structure": "Area",
      "version": "FortressGame"
    },
    "youtube": "7a54Ha1B58Q"
  },
  {
    "description": "Exploration?",
    "filename": "luma",
    "mark": "fortress",
    "metadata": {
      "albumArtist": "Senking",
      "artist": "Senking",
      "title": "Luma",
      "year": "2010"
    },
    "source": {
      "client": "STW",
      "date": "2012-06-22",
      "structure": "Combat",
      "version": "FortressGame"
    },
    "youtube": "06z_H-iASUQ"
  },
  {
    "description": "Combat",
    "filename": "newcombat",
    "mark": "fortress",
    "metadata": {
      "albumArtist": "Kangding Ray",
      "artist": "Kangding Ray",
      "title": "OR / 'New Combat'",
      "year": "2011"
    },
    "source": {
      "client": "STW",
      "date": "2012-06-22",
      "structure": "Combat",
      "version": "FortressGame"
    },
    "youtube": "w84PKh8DyOU"
  },
  {
    "description": "Morning Exploration",
    "filename": "torul",
    "mark": "fortress",
    "metadata": {
      "albumArtist": "Lucy",
      "artist": "Lucy",
      "title": "torul",
      "year": "2011"
    },
    "source": {
      "client": "STW",
      "date": "2012-06-22",
      "structure": "Area",
      "version": "FortressGame"
    },
    "youtube": "l-t6AzOfjMk"
  },
  {
    "description": "Exploration?",
    "filename": "unlighted",
    "mark": "fortress",
    "metadata": {
      "albumArtist": "Senking",
      "artist": "Senking",
      "title": "Unlighted",
      "year": "2010"
    },
    "source": {
      "client": "STW",
      "date": "2012-06-22",
      "structure": "Combat",
      "version": "FortressGame"
    },
    "youtube": "QxsL3PaR-iU"
  }
]