[
  {
    "description": "'Help Ramirez' ending cutscene",
    "filename": "Fort_Cine_Onboarding_Rocket",
    "mark": "alpha",
    "metadata": {
      "albumArtist": "Epic Games",
      "artist": "Rom Di Prisco",
      "title": "Rocket Cutscene",
      "year": "2015"
    },
    "source": {
      "client": "STW",
      "date": "2015-12-09",
      "structure": "Cutscene",
      "version": "Online Test 6"
    },
    "youtube": "qA6hIlQob6A"
  },
  {
    "description": "Viewing mission rewards",
    "filename": "fort_rewardscreen_Music_Intro",
    "mark": "alpha",
    "metadata": {
      "albumArtist": "Epic Games",
      "artist": "Rom Di Prisco",
      "title": "Reward Screen",
      "year": "2016"
    },
    "source": {
      "client": "STW",
      "date": "2016-07-25",
      "structure": "UI",
      "version": "Online Test 8"
    },
    "youtube": "OMPEPoQZch8"
  },
  {
    "description": "viewing mission rewards",
    "filename": "fort_rewardscreen_Music_SecondLoopFix",
    "mark": "alpha",
    "metadata": {
      "albumArtist": "Epic Games",
      "artist": "Rom Di Prisco",
      "title": "Reward Screen (Second Loop)",
      "year": "2016"
    },
    "source": {
      "client": "STW",
      "date": "2016-07-25",
      "structure": "UI",
      "version": "Online Test 8"
    },
    "youtube": "EDSiv7Ufa9E"
  },
  {
    "description": "Viewing Squads or Skill Tree",
    "filename": "fortnite_daytime_music_positive_one",
    "mark": "alpha",
    "metadata": {
      "albumArtist": "Epic Games",
      "artist": "Rom Di Prisco",
      "title": "Squads / Skill Tree",
      "year": "2014"
    },
    "source": {
      "client": "STW",
      "date": "2014-12-02",
      "structure": "UI",
      "version": "Online Test 1"
    },
    "youtube": "5ZvRcg-lPMc"
  },
  {
    "description": "Setting up Homebase",
    "filename": "fortnite_daytime_music_positive_two",
    "mark": "alpha",
    "metadata": {
      "albumArtist": "Epic Games",
      "artist": "Rom Di Prisco",
      "title": "Naming Your Homebase",
      "year": "2014"
    },
    "source": {
      "client": "STW",
      "date": "2014-12-02",
      "structure": "UI",
      "version": "Online Test 1"
    },
    "youtube": "czUd84sEV-g"
  },
  {
    "description": "Viewing Homebase and quests",
    "filename": "fortnite_homebase_music_loop",
    "mark": "alpha",
    "metadata": {
      "albumArtist": "Epic Games",
      "artist": "Rom Di Prisco",
      "title": "Homebase",
      "year": "2014"
    },
    "source": {
      "client": "STW",
      "date": "2014-12-02",
      "structure": "UI",
      "version": "Online Test 1"
    },
    "youtube": "QA3baa8cucI"
  },
  {
    "description": "Login Screen before v3.00",
    "filename": "fortnite_login_screen",
    "mark": "alpha",
    "metadata": {
      "albumArtist": "Epic Games",
      "artist": "Rom Di Prisco",
      "title": "Login Screen",
      "year": "2014"
    },
    "source": {
      "client": "STW",
      "date": "2014-12-02",
      "structure": "UI",
      "version": "Online Test 1"
    },
    "youtube": "g-I0l-LH77s"
  },
  {
    "description": "'Help Ramirez' combat track",
    "filename": "fortnite_onboarding_cave_action",
    "mark": "alpha",
    "metadata": {
      "albumArtist": "Epic Games",
      "artist": "Rom Di Prisco",
      "title": "Cave Action",
      "year": "2015"
    },
    "source": {
      "client": "STW",
      "date": "2015-12-09",
      "structure": "Combat",
      "version": "Online Test 6"
    },
    "youtube": "aitAk7JgI_o"
  },
  {
    "description": "'Help Ramirez' background music",
    "filename": "fortnite_onboarding_cave_music",
    "mark": "alpha",
    "metadata": {
      "albumArtist": "Epic Games",
      "artist": "Rom Di Prisco",
      "title": "Cave Exploration",
      "year": "2015"
    },
    "source": {
      "client": "STW",
      "date": "2015-12-09",
      "structure": "Area",
      "version": "Online Test 6"
    },
    "youtube": "OVV2Kd3mehA"
  },
  {
    "description": "Viewing Loot Llamas",
    "filename": "llamaopen",
    "mark": "alpha",
    "metadata": {
      "albumArtist": "Epic Games",
      "artist": "Rom Di Prisco",
      "title": "Loot Llama (Alpha)",
      "year": "2015"
    },
    "source": {
      "client": "STW",
      "date": "2015-09-29",
      "structure": "UI",
      "version": "Online Test 5"
    },
    "youtube": "4AfN_eWN2g8"
  },
  {
    "description": "Opening Loot Llamas",
    "filename": "new_victory_loop",
    "mark": "alpha",
    "metadata": {
      "albumArtist": "Epic Games",
      "artist": "Rom Di Prisco",
      "title": "Llama Rewards",
      "year": "2015"
    },
    "source": {
      "client": "STW",
      "date": "2015-09-29",
      "structure": "UI",
      "version": "Online Test 5"
    },
    "youtube": "M29n6lF9Yz8"
  },
  {
    "description": "'Help Ramirez' combat track",
    "filename": "Onboarding_Combat_Loop",
    "mark": "alpha",
    "metadata": {
      "albumArtist": "Epic Games",
      "artist": "Rom Di Prisco",
      "title": "Combat Alt",
      "year": "2015"
    },
    "source": {
      "client": "STW",
      "date": "2015-12-09",
      "structure": "Combat",
      "version": "Online Test 6"
    },
    "youtube": "rfeaZ36do5A"
  },
  {
    "description": "'Help Ramirez' quest ending track",
    "filename": "Onboarding_CountDown_Music",
    "mark": "alpha",
    "metadata": {
      "albumArtist": "Epic Games",
      "artist": "Rom Di Prisco",
      "title": "Countdown",
      "year": "2015"
    },
    "source": {
      "client": "STW",
      "date": "2015-12-09",
      "structure": "Cutscene",
      "version": "Online Test 6"
    },
    "youtube": "XmLxKm64h9k"
  },
  {
    "description": "'Help Ramirez' combat track",
    "filename": "onboarding_high_combat_loop",
    "mark": "alpha",
    "metadata": {
      "albumArtist": "Epic Games",
      "artist": "Rom Di Prisco",
      "title": "High Combat",
      "year": "2016"
    },
    "source": {
      "client": "STW",
      "date": "2016-07-25",
      "structure": "Combat",
      "version": "Online Test 8"
    },
    "youtube": "4GWWYIq0fI4"
  },
  {
    "description": "Save The World Intro Cinematic",
    "filename": "onboarding_intro_TEMP_CINE_introrender",
    "mark": "alpha",
    "metadata": {
      "albumArtist": "Epic Games",
      "artist": "Rom Di Prisco",
      "title": "Intro Cinematic",
      "year": "2016"
    },
    "source": {
      "client": "STW",
      "date": "2016-07-25",
      "structure": "Cutscene",
      "version": "Online Test 8"
    },
    "youtube": "1RYdtvEKU5s"
  },
  {
    "description": "'Help Ramirez' combat track",
    "filename": "Onboarding_Main_Combat_Loop",
    "mark": "alpha",
    "metadata": {
      "albumArtist": "Epic Games",
      "artist": "Rom Di Prisco",
      "title": "Combat",
      "year": "2015"
    },
    "source": {
      "client": "STW",
      "date": "2015-12-09",
      "structure": "Combat",
      "version": "Online Test 6"
    },
    "youtube": "JtX3aJhOQCc"
  },
  {
    "description": "'Help Ramirez' opening cutscene",
    "filename": "Onboarding_Ramirez_SFX_Music_VO_03",
    "mark": "alpha",
    "metadata": {
      "albumArtist": "Epic Games",
      "artist": "Epic Games",
      "title": "Ramirez Cutscene",
      "year": "2016"
    },
    "source": {
      "client": "STW",
      "date": "2016-07-25",
      "structure": "Cutscene",
      "version": "Online Test 8"
    },
    "youtube": "5z8mHQBDMk4"
  },
  {
    "description": "Finding the rocket in 'Help Ramirez'",
    "filename": "onboarding_rocket_room_loop",
    "mark": "alpha",
    "metadata": {
      "albumArtist": "Epic Games",
      "artist": "Rom Di Prisco",
      "title": "Rocket Room",
      "year": "2016"
    },
    "source": {
      "client": "STW",
      "date": "2016-07-25",
      "structure": "Area",
      "version": "Online Test 8"
    },
    "youtube": "agwyTRjtAOo"
  },
  {
    "description": "Protecting the rocket in 'Help Ramirez'",
    "filename": "rocket_tension_loop",
    "mark": "alpha",
    "metadata": {
      "albumArtist": "Epic Games",
      "artist": "Rom Di Prisco",
      "title": "Rocket Tension",
      "year": "2016"
    },
    "source": {
      "client": "STW",
      "date": "2016-07-25",
      "structure": "Combat",
      "version": "Online Test 8"
    },
    "youtube": "GSh4cNo7GGo"
  },
  {
    "description": "Viewing the Vault or Vindertech Store",
    "filename": "vindertech store v2",
    "mark": "alpha",
    "metadata": {
      "albumArtist": "Epic Games",
      "artist": "Rom Di Prisco",
      "title": "Vault / Vindertech Store (Alpha)",
      "year": "2015"
    },
    "source": {
      "client": "STW",
      "date": "2015-09-29",
      "structure": "UI",
      "version": "Online Test 5"
    },
    "youtube": "XBLWSBGIPOY"
  },
  {
    "description": "Viewing the World Map",
    "filename": "world_map_overview_music_a",
    "mark": "alpha",
    "metadata": {
      "albumArtist": "Epic Games",
      "artist": "Rom Di Prisco",
      "title": "World Map",
      "year": "2015"
    },
    "source": {
      "client": "STW",
      "date": "2015-06-29",
      "structure": "UI",
      "version": "Online Test 3"
    },
    "youtube": "ciUr5OX4WRY"
  }
]