[
  {
    "description": "Lobby music until Season 3",
    "filename": "fort_lobby_music_athena",
    "mark": "s1",
    "metadata": {
      "albumArtist": "Epic Games",
      "artist": "Epic Games",
      "title": "OG (Classic)",
      "year": "2017"
    },
    "source": {
      "client": "STW",
      "date": "2017-09-12",
      "structure": "UI",
      "version": "1.6.0"
    },
    "youtube": "fQ1uau2Ep34"
  },
  {
    "description": "Battle Bus music",
    "filename": "SFX_Bus_Flying_PartyMusic_Loop",
    "mark": "s1",
    "metadata": {
      "albumArtist": "Epic Games",
      "artist": "Epic Games",
      "title": "Battle Bus music",
      "year": "2017"
    },
    "source": {
      "client": "STW",
      "date": "2017-09-12",
      "structure": "Extra",
      "version": "1.6.0"
    },
    "youtube": "vQbw_wpVUMY"
  }
]