[
  {
    "description": "Track Description",
    "filename": "filename1",
    "mark": "imagetest",
    "metadata": {
      "albumArtist": "Epic Games",
      "artist": "Artist",
      "title": "Title",
      "year": "2010"
    },
    "source": {
      "client": "C1S1",
      "date": "2010-01-01",
      "structure": "FolderName",
      "version": "1.00"
    },
    "youtube": "dwlGJS1b08g"
  },
  {
    "decoration": {
      "minorTrack": true
    },
    "description": "Track Description",
    "filename": "filename2",
    "mark": "imagetest",
    "metadata": {
      "albumArtist": "Epic Games",
      "artist": "Artist",
      "title": "Title2",
      "titleAlt": "Alt Title2",
      "year": "2010"
    },
    "source": {
      "structure": "Website"
    },
    "youtube": "w9FJhoIyLqs"
  }
]
