[
    {
        "description": "Background music when viewing mission rewards",
        "filename": "fort_rewardscreen_Music_Intro",
        "mark": "base",
        "metadata": {
            "albumArtist": "Epic Games",
            "artist": "Rom Di Prisco",
            "title": "Homebase",
            "year": "2015"
        },
        "source": {
            "client": "STW",
            "date": "2015-12-02",
            "structure": "UI",
            "version": "Online Test"
        },
        "youtube": "OMPEPoQZch8"
    },
    {
        "description": "Alt music when viewing mission rewards",
        "filename": "fort_rewardscreen_Music_SecondLoopFix",
        "mark": "base",
        "metadata": {
            "albumArtist": "Epic Games",
            "artist": "Rom Di Prisco",
            "title": "Homebase",
            "year": "2015"
        },
        "source": {
            "client": "STW",
            "date": "2015-12-02",
            "structure": "UI",
            "version": "Online Test"
        },
        "youtube": "EDSiv7Ufa9E"
    }
]