[
  {
    "description": "Used in 'Fortnite Experience Trailer'",
    "filename": "EcstaticSteps",
    "mark": "media",
    "metadata": {
      "albumArtist": "Various Artists",
      "artist": "Bustafunk",
      "title": "Ecstatic Steps",
      "year": "2013"
    },
    "source": {
      "client": "YT",
      "structure": "Trailer",
      "date": "2014-12-01"
    },
    "youtube": "gD8DYVmA6FI"
  },
  {
    "description": "Used in 'FORTNITE SEASON 5 | ANNOUNCE TRAILER'",
    "filename": "JoywaveBlastoffff",
    "mark": "media",
    "metadata": {
      "albumArtist": "Joywave",
      "artist": "Joywave",
      "title": "Blastoffff",
      "year": "2018"
    },
    "source": {
      "client": "YT",
      "structure": "Trailer",
      "date": "2018-07-12"
    },
    "youtube": "qSid2ulDL2Q"
  }
]
